{
  "caseId": "FLD-003",
  "hiddenCompletion": [],
  "mustNotInferZones": [],
  "mustNotMerge": [],
  "overlapRelations": [],
  "physicalPieces": [],
  "reviewMetadata": {
    "notes": null,
    "reviewedAt": null,
    "reviewer": null
  },
  "reviewStatus": "PENDING_EXTERNAL_REVIEW",
  "schemaVersion": "1.0.0-review-draft"
}
